<?xml version="1.0"?>
<rubrica
    xmlns:xsi="http://www.w3.org/2001/XMLSchema-instance"
    xsi:noNamespaceSchemaLocation="rubrica.xsd">
    <contatto> <!-- complex type -->
        <nome></nome> <!-- simple type -->
        <cognome></cognome>
        <indirizzo></indirizzo>
        <telefono>4567</telefono>
        <telefono>34569</telefono>
        <telefono>678765</telefono>
        <telefono>567876543</telefono>
        <email></email>
        <email></email>
        <email></email>
        <website url="ok">google.com</website>
    </contatto>
    <contatto>
        <nome></nome>
        <cognome></cognome>
        <indirizzo></indirizzo>
        <telefono>13245</telefono>
        <email></email>
        <website></website>
    </contatto>

</rubrica>